{
  "schema_version": "0.1",
  "name": "zlib-cve-2022-37434-impact",
  "advisory": {
    "id": "CVE-2022-37434",
    "project": "zlib",
    "summary": "zlib through 1.2.12 can overflow or over-read while inflate() processes a gzip header extra field for applications that call inflateGetHeader().",
    "vuln_family": "memory_safety",
    "references": [
      "https://nvd.nist.gov/vuln/detail/CVE-2022-37434",
      "https://github.com/madler/zlib/commit/eff308af425b67093bab25f80f1ae950166bece1",
      "https://github.com/madler/zlib/commit/1eb7682f845ac9e9bf9ae35bbfb3bad5dacbd91d",
      "https://www.zlib.net/fossils/zlib-1.2.12.tar.gz",
      "https://www.zlib.net/fossils/zlib-1.2.13.tar.gz"
    ],
    "source_hints": [
      {
        "file": "inflate.c",
        "function_or_sink": "inflate",
        "description": "gzip FEXTRA processing after inflateGetHeader() stores header.extra metadata"
      }
    ]
  },
  "version_source": {
    "type": "git",
    "repository": ".targets/zlib-cve-2022-37434-git",
    "explicit": [
      {"version": "1.2.12", "ref": "v1.2.12", "role": "suspected_affected"},
      {"version": "1.2.13", "ref": "v1.2.13", "role": "fixed_control"}
    ],
    "discover": {
      "enabled": false,
      "include": ["v1.2.*"],
      "exclude": ["*rc*", "*alpha*", "*beta*"],
      "limit": 20
    }
  },
  "replay": {
    "corpus_ref": "CVE-2022-37434"
  },
  "intelligence": {
    "enabled": false,
    "queries": [
      "CVE-2022-37434 zlib inflateGetHeader PoC",
      "zlib gzip extra field inflateGetHeader overflow"
    ],
    "max_results": 10
  },
  "source_signatures": [
    {
      "name": "unchecked-gzip-extra-copy",
      "classification": "vulnerable",
      "file": "inflate.c",
      "contains_all": [
        "state->head->extra != Z_NULL) {",
        "len = state->head->extra_len - state->length;",
        "state->head->extra_max - len : copy"
      ],
      "absent_all": ["len < state->head->extra_max"]
    },
    {
      "name": "bounded-gzip-extra-copy",
      "classification": "fixed",
      "file": "inflate.c",
      "contains_all": [
        "state->head->extra != Z_NULL &&",
        "(len = state->head->extra_len - state->length) <",
        "state->head->extra_max) {"
      ]
    }
  ]
}
