{
  "schema_version": "0.1",
  "name": "protobuf-cve-2025-4565-impact",
  "advisory": {
    "id": "CVE-2025-4565",
    "project": "protobuf",
    "summary": "protobuf-python pure-Python backend can exceed Python recursion limits while parsing protobuf data with many recursive group tags, causing denial of service.",
    "vuln_family": "deserialization",
    "references": [
      "https://github.com/protocolbuffers/protobuf/security/advisories/GHSA-8qvm-5x2c-j2w7",
      "https://nvd.nist.gov/vuln/detail/CVE-2025-4565",
      "https://github.com/protocolbuffers/protobuf/commit/17838beda2943d08b8a9d4df5b68f5f04f26d901",
      "https://pypi.org/project/protobuf/5.29.4/",
      "https://pypi.org/project/protobuf/5.29.5/"
    ],
    "source_hints": [
      {
        "file": "google/protobuf/internal/decoder.py",
        "function_or_sink": "_DecodeUnknownField",
        "description": "Recursive group parsing in the pure-Python decoder"
      }
    ]
  },
  "version_source": {
    "type": "git",
    "repository": ".targets/protobuf-cve-2025-4565-git",
    "explicit": [
      {"version": "5.29.4", "ref": "v5.29.4", "role": "suspected_affected"},
      {"version": "5.29.5", "ref": "v5.29.5", "role": "fixed_control"}
    ],
    "discover": {
      "enabled": false,
      "include": ["v5.29.*"],
      "exclude": ["*rc*", "*alpha*", "*beta*"],
      "limit": 20
    }
  },
  "replay": {
    "corpus_ref": "CVE-2025-4565"
  },
  "intelligence": {
    "enabled": false,
    "queries": [
      "CVE-2025-4565 protobuf PoC",
      "GHSA-8qvm-5x2c-j2w7 proof of concept"
    ],
    "max_results": 10
  },
  "source_signatures": [
    {
      "name": "unbounded-unknown-group-recursion",
      "classification": "vulnerable",
      "file": "google/protobuf/internal/decoder.py",
      "contains_all": ["def _DecodeUnknownField", "WIRETYPE_START_GROUP"],
      "absent_all": ["DEFAULT_RECURSION_LIMIT", "SetRecursionLimit"]
    },
    {
      "name": "pure-python-recursion-limit",
      "classification": "fixed",
      "file": "google/protobuf/internal/decoder.py",
      "contains_all": ["DEFAULT_RECURSION_LIMIT", "SetRecursionLimit", "too many levels of nesting"]
    }
  ]
}
